{
  "schema_version": 1,
  "source_id": "curse-detection-data",
  "source_revision": "ff241621e103b6f220d30de324d0d07987887308",
  "artifact_sha256": "1c3489417e4972dbbbdde19cc47bb8638292891f7f1a443ecbdc2e3c6843545a",
  "source_row_count": 5825,
  "source_label_counts": {
    "0": 3781,
    "1": 2044
  },
  "sensitive_pattern_excluded_count": 25,
  "eligible_source_label_counts": {
    "0": 3762,
    "1": 2038
  },
  "selected_count": 2500,
  "selected_source_label_counts": {
    "0": 500,
    "1": 2000
  },
  "generated_label_counts": {
    "positive": 0,
    "hard-negative": 0,
    "review": 2500
  },
  "source_statistics": [
    {
      "source_id": "curse-detection-data",
      "selected_count": 2500,
      "share": 1.0
    }
  ],
  "slice_counts": {
    "unadjudicated-intake": 2500
  },
  "adjudication_quality": {
    "adjudicated": 0,
    "single_review": 0,
    "double_review": 0,
    "disagreement": 0,
    "pending_review": 2500
  },
  "bias_findings": [
    "One source supplies 100% of this intake; add at least two independent sources and curated negative slices before gold evaluation."
  ],
  "gold_ready": false,
  "completion_blockers": [
    "2500 review cases still require Koguard-policy adjudication and exact spans.",
    "Automated sensitive-pattern exclusion still requires manual privacy review.",
    "Independent hidden evaluation material is not part of this public intake."
  ]
}
